disease,postLink,postHeading,postContent,postTags
Multiple Sclerosis,https://messageboards.webmd.com/health-conditions/f/multiple-sclerosis/8922/ms-support,MS support,I was diagnosed with MS in 2011. I have family support but it's hard to talk to my husband about it. I would like to talk to someone who can understand what I'm going through and not dismiss it. Its hard dealing with this and sometimes I just need someone to talk to that know what I'm going through.,
Multiple Sclerosis,https://messageboards.webmd.com/health-conditions/f/multiple-sclerosis/40932/ms,MS..?,"I am a 23 year old female suffering from chronic leg pain, tingling and reduced sensation. I'm extremely fatigued and feel very weak sometimes. Back in late November I experienced numbness in the right side of my face that subsided in about an hour or 2. I also expirience muscle/limb twitching and jerks on a daily basis. This past friday I experienced another episode of numbness but on the left side of my face and tongue. It is now Monday the 19th of february and I am still experiencing this numbness and it occasionally spreads to my whole face but then will return to just my left side and can't seem to get my left arm to hang on very well without dropping something or getting it where i need it in time to stop a cabinent door from slamming. I have reduced sensation from the neck down as well. Blood work and CT scan of head and neck were all normal. Does anybody have some suggestions on what this may be or what to talk to my doctor about??? Thank you!",Symptoms
Multiple Sclerosis,https://messageboards.webmd.com/health-conditions/f/multiple-sclerosis/42008/pain-medications,Pain medications,"I have had MS since possibly 45. I am now 63. I have been on ultram for many years and it seems to help keep my mind balance and the pain within reason. My regular doctor of many many yrs has retired and I have been feeling like so bullied taking 2 ultrams a day from 4 doctors. Even my primary care that I have been seeing for over a year is telling me the ultram has to go. She also made me give up the few vicodins I got a month when pain broke through. With all this frustration, I now have anxiety. So those meds have also been manipulated away from me. They did piss tests me on for over a year and NO, i am not an addict. So what is working for people who have MS pains plus I have fibromyalgia. I had to go around my doctor, trying to find another doctor and she at last referred me to pain clinic. However, she would not take me on as new patient due to being prescribed ultrams. What is going on?? anybody got a clue. I don't do well with smoking pot. My doctor wants to put me down a rigorous mental medications treatments, and I am so allergic to any anti depressant they have tried me on for the past 20 yrs. I am not chemically depressed, but the anxiety is there at times, but my guess I am feeling bullied and my stability is at risk, which I believe in return, may put me in a tail spin of the MS> I am on no meds, I walk and fight this disease, but feel like I am losing the battle with finding a descent doctor. Even my neurologist is saying well, pain pills are the number 1 problem of opioids in this country. Well, some of us survive on a few pills a day to have a quality of life. Why punish us all that have known issues and quite documented. Any suggestions??",
Multiple Sclerosis,https://messageboards.webmd.com/health-conditions/f/multiple-sclerosis/52332/testing-for-ms,Testing for MS,"One additional thought, after seeing several posts.... I was told by three separate MS ""specialists"" that the need for lumbar/spinal taps to determine MS was unnecessary. It appeared - in their opinion - that the gold standard was the MRI results.  Since this was all around 2006, maybe that has changed? However, I don't know that I would put myself through a spinal tap, when I already had the MRI to confirm the MS. Good luck....and don't let the doctors bully you around. If they DO try to bully, it's time for a new neurologist. (IMHO).",Diagnosis
Oral Health,https://messageboards.webmd.com/health-conditions/f/oral-health/73177/no-blood-clots-or-pain-after-wisdom-teeth-extraction,No blood clots or pain after wisdom teeth extraction?,I had my top two wisdom teeth removed yesterday and I looked in my mouth to see how they were healing and noticed there were no blood clots on either side. I haven’t had very much pain and it’s been manageable with only a few ibuprofen. I also looked at pictures of dry socket so it doesn’t seem to be that. Am I okay?,"Dental Procedures , Tooth Problems"
Multiple Sclerosis,https://messageboards.webmd.com/health-conditions/f/multiple-sclerosis/48117/is-it-worth-mentioning-to-my-doctor,Is it worth mentioning to my doctor?,"Hello, I am a 33 year old Caucasian female. I have not been diagnosed with MS and don't have a family history that I am aware of. However, I seem to have most of the symptoms associated with the disease. My memory is horrible; I can forget what a topic of a conversation was after a small pause and will often forget why I was trying to figure out something in my head, for example this morning I was trying to figure out how much I get paid per day at my job and as soon as I had the simple equation in my mind I forgot why I was doing the math. I remembered after something else slipped my mind in the same way, which I can't remember what it was. I have the worst insomnia. I get tired quickly through physical activity. Taking a shower often takes all the energy out of me and I have to force myself to finish tasks if I have multiple to accomplish. Once I'm done I will be down for the rest of the day. If I get hot I almost immediately feel dizzy and nauseated. I have a headache every day. I have been diagnosed with anxiety and depression and take medication for those. My balance is not the best. I often trip on flat ground because I just don't lift my foot high enough. Along with that I am very clumsy. I run into door jams or tables, as well as other things, because I misjudge the space I have to go between or how sharp of a turn to make. I easily drop things for no reason. My legs easily move when I need to walk and I have no issues moving body parts when I need to. My vision is bad and I wear prescription glasses, although I have had this problem since I was in my teens and most of my relatives also wear glasses. My prescription does get slightly worse every year, however. I will not realize that my, (often left leg/foot) is asleep until after I try to walk on it. My balance is bad, especially when attempting to exercise. (I will lose balance while doing squats despite having arms stretched out and a straight back after 10 or so, for example.) Yoga is very hard solely due to balance. My strength and flexibility is improving through yoga but my balance is where it was day 1. I have a couple things I am not sure are associated but I wonder if could be: I don't have any numbness in my limbs or extremities other than the falling asleep thing described above. However, I have a weird numbing sensation in my back on the left in a very specific location, which sort of feels like a tingling sensation from like a light fabric being repeatedly brushed over the area. Quite a few months ago I had the same sensation on the right side. The last thing I am experiencing has to do with my bladder. I don't have incontinence or accidents. I actually have the opposite problem , I will unequivocally have a full bladder and as soon as I sit on the toilet, I am unable to go. It takes several minutes and when I do, the stream is weak and I have to use all the strength I have to squeeze the urine out of my bladder. During the time I am urinating if I try to just let it flow, I will stop. This is more likely to happen after I have been holding it, or don't have fluids in my system to help ease it along, such as in the middle of the night or first thing in the morning. During the day, as I drink water throughout the day, I easily go, frequently. I'm talking every 30 minutes to an hour for the first half of my day, even if I am just sipping the water. I understand that that, as well as many of the symptoms I described can be associated with many things. I just want to know if the problems with the numbness in my back and emptying my bladder could be associated with MS along with everything else I described. How should I approach my doctor with these symptoms and my suspicions? Could I have just fallen into the rabbit hole when I was trying to figure out why I can't pee and why my back has that weird tingling? Should I wait and see if my symptoms get worse?  Thank you for reading and I appreciate replies. I apologize for length, I wanted to give as much detail as possible.","Symptoms , Diagnosis"
Multiple Sclerosis,https://messageboards.webmd.com/health-conditions/f/multiple-sclerosis/58409/keeping-your-marriage-together-through-the-mess,Keeping your marriage together through the MeSs,"Hello everyone, my name is Stephanie and I have been diagnosed with MS for 22 years. My husband and I just celebrated our 26 year anniversary. My husband lately is displaying in different ways that he may be reaching a breaking point in dealing with the MS and the limitations it is putting in his life as far as moving forward. I am trying to communicate understanding, but I don't want to lose him. Feeling stuck and don't know how to help him. He won't go to support groups and is not sure he wants to try marriage counseling. Any thoughts, support or suggestions would be much appreciated!!",
Oral Health,https://messageboards.webmd.com/health-conditions/f/oral-health/72742/swish-swish,Swish Swish,Are there any benefits to using mouthwash. Does it do more than freshen your breath? Is Listerine the best to use. What is the best to use? Should I continue using mouthwash,"Bad Breath , Teeth Whitening"
Mental Health,https://messageboards.webmd.com/health-conditions/f/mental-health/76750/i-m-sick-of-being-a-lab-rat,I'm sick of being a lab rat,"In 2009 I was diagnosed as Bipolar. Almost 10 years and several medications later, I don't think this was correct. I've tried it all. Lexapro, Zoloft, Neurontin, Lithium, Risperdal, Trazadone, Seroquel... plus more. Most recently I was on a combination of Lithium 450 2x a day, Zoloft 200 1x a day, Seroquel 400 1x at bedtime, Xanax .5 3x a day, Antabuse 1x a day for alcoholism. Before I started the Antabuse I was drinking and mixing these meds and had 3 seizures so if you are on meds, PLEASE BE CAREFUL! But I recently started taking the Antabuse and had 2 episodes where I was so disoriented and confused I almost went to the ER in fear of a stroke. Turns out to be a negative side effect of the Antabuse. So I am done. I am quitting all these medications and going to a more holistic and herbal approach. The Lithium obviously hasn't helped over the past ten years because I still get so depressed I turn to alcohol and my visits to Rehabs and Psych wards have not slowed or helped. These medications are making things worse as I see it. I failed to mention, when I was diagnosed as Bipolar, I was heavily using cocaine on a daily basis. I have not used any drugs in at least a year and alcohol in 2 weeks. Does anyone have any advice? Herbal supplement suggestions? I am not going to return to the psychiatrist for the simple fact that I leave with more than I started with. Also, even with the medications, I attempted suicide twice... it wasn't a permanent threat, more like a cry for help because I was so ""squirrelly"" inside my head. Thanks for listening and I wish everyone only the best.","Anxiety & Panic Disorders , Depression , Substance Abuse , Bipolar Disorder , Personality Disorders"
Mental Health,https://messageboards.webmd.com/health-conditions/f/mental-health/76519/new-trauma-blog,New trauma blog,"I am starting a new blog about my trauma and healing journey. I am hoping to build a community of trauma survivors who have gone through similar events (EMDR, PTSD, anxiety, depression) in hopes of finding support and advice. Join me on my journey as I try to better understand my trauma and path to healing through personal blog posts, humor and hope at traumaqueenblog.com","Anxiety & Panic Disorders , Abuse Victims , Depression , Eating Disorders , Self Harm"
Mental Health,https://messageboards.webmd.com/health-conditions/f/mental-health/76531/increasing-lexapro-dose-and-taking-off-wellbutrin,Increasing Lexapro dose and taking off wellbutrin,"I have been taking paxil 10mg and wellbutrin 150 mg for more than 4 years, results were not good and i was always scared of stopping paxil cause of the withdrawal symptoms, I had multiple panic attacks, severe procrastination depression attacks and life was not that easy on me as well and went through 2 tough life situations in the last 3 years and as my symptoms increased , I asked the GP from 3 months to change the paxil and try another one, he recommended Lexapro 10mg which worked great in the beginning, but unfortunately not for long, I was now thinking of asking him to increase it to 20mg and also stopping wellbutrin 150, did anyone try this , would you recommend it, also what else I can do beside the meds to have less depression , procrastination and be more in control of myself?","Anxiety & Panic Disorders , Depression , Self Harm"
Mental Health,https://messageboards.webmd.com/health-conditions/f/mental-health/76649/mental-breakdown-anxiety,Mental Breakdown Anxiety,"I’ve had 3 mental breakdowns and ended up in a mental hospital. I was in there for 2 months. I had electric shock treatment. You need to see your doctor who will probably send you to a psychiatrist. They should put you on antidepressants and try and find the reason for your depression and anxiety. It took a lot of time to find the right drug for me. It is Citalopram here in the U.K. It helps with depression and anxiety attacks, which I thought was the worse thing to happen. You think you are dying. I’ve been on them for years now. I still suffer with depression and some anxiety, but I talk to my psychiatrist and it’s not so bad. You will feel better but you need to see a doctor.","Anxiety & Panic Disorders , Depression , Bipolar Disorder"
Mental Health,https://messageboards.webmd.com/health-conditions/f/mental-health/72967/first-post,First post,Never had a worry until a few years ago. In the last 3 years I lost my mother and had health issues. Well it was a bit of a battle but it looks like I beat my health issues. Problem is metally I am a wreck. Every little ache I think is fatal. Cant get passed the loss of my mother. I am a 56 year old male and proud dad of teenage twin girls. Not to get totally in to it but I am basically sole provider to them both financially and emotionally. Always was so strong until these last few years. I see people who are much worse living life. Me ... I just cant cope. This is very new to me. I was always the one giving help. Never the one to need it. Will be contacting therapists depending on affordability but thought something like this might help as well. Need to get on with life. Hope this makes sense. As I grow more comfortable will try to open up more. Would like conversation.,"Anxiety & Panic Disorders , Depression"
Mental Health,https://messageboards.webmd.com/health-conditions/f/mental-health/76934/https-www-smore-com-fjdr8-keranique-hair-regrowth-treatment,https://www.smore.com/fjdr8-keranique-hair-regrowth-treatment,"Keranique Minimizing Stress That is one the hair regrowth tips you will not want to ignore. Anxiety includes a very negative influence on the human body in general. When people become stressed, they commence to see a numerous amount of undesirable symptoms including muscle tension, poor circulation, headaches, ulcers, insomnia, panic attacks, irritability, etc . Each one of these effects creates stress which in turn causes the body to job against itself.",
Mental Health,https://messageboards.webmd.com/health-conditions/f/mental-health/61725/do-i-have-schizophrenia,Do I have Schizophrenia?,"I have been told many times that I'm paranoid and delusional. I have held off seeing a psychiatrist for years. Here's a short list of a few issues I have daily. - I have a hard time showing any emotion with deaths/illness of family members. Even if I feel it inside. But I get teary eyed during sad and happy movies. - My voice in my head narrates almost everything I do. It's my voice but I will hear it in different accents. - People catch me talking to myself aloud and I didn't even realize it.  - I avoid family members and friends. - I seldom make eye contact and look down when walking by people - I don't dislike people but more afraid they will dislike me - I get very nervous around people and avoid social interactions - I have shaky hands, noticable while holding something. - I have trouble speaking to people sometimes, the words don't come out right. - Large periods of time seem to disappear - Reality sometimes feel dream-like - I have little motivation to get anything accomplished. When I do I seldom finish anything - I wear the same thing everyday but clean, have multiple duplicates of clothes.  These are just a few problems I face daily. Thank you for your responses.","Anxiety & Panic Disorders , Depression , Schizophrenia , Bipolar Disorder , Personality Disorders"
Multiple Sclerosis,https://messageboards.webmd.com/health-conditions/f/multiple-sclerosis/9688/ms-and-spondylitis,MS and Spondylitis,"I was diagnosed with MS in 2001 and am fortunate to have only had one flare since the early stages, even though I haven't taken MS meds since 2006. I am now in the process of trying to get a diagnosis for other symptoms which fit Ankylosing Spondylitis. TNF inhibitors are sometimes used for treatment, however, I've read that they shouldn't be used by MS patients. I'm wondering if anyone here also has Spondylitis and what medication they're taking. Methotrexate is another drug used, which I've read may also be beneficial for MS. NSAIDS have not been effective enough, so I'm thinking I may need something stronger. I'll be seeing a rheumatologist in a couple of weeks, and want to go in with as much knowledge as possible. The first rheumatologist I saw didn't give me any diagnosis because blood work wasn't conclusive, even though the labs show I have inflammation and I have several other symptoms. Another doctor suspects Spondylitis, which is how I learned about it. I appreciate any information or advice anyone here can provide.",
Multiple Sclerosis,https://messageboards.webmd.com/health-conditions/f/multiple-sclerosis/42625/cannabis-friendly-ms-support-group,Cannabis friendly ms support group.,Hello warriors. My name is Sherry. I have MS... I started a cannabis friendly MS support group. Knowledge is power. Please feel free to join my group and share your stories. Love and light to all of you.,
Multiple Sclerosis,https://messageboards.webmd.com/health-conditions/f/multiple-sclerosis/40009/depression,Depression,"I was barely treading water with this stupid disease, and then got a terrible case of flu that pushed me beyond coping abilities. I almost Couldn’t care for myself At Times, and I fell into major self pity and a terrible funk- it’s hard to get Help when others are tone deaf and are unable to help. I cannot be only hopeless MS person. I do t want to give up, But it’s tempting. Any tips for surviving as I live this out? Alone. Living alone..thanks",Living & Managing
Multiple Sclerosis,https://messageboards.webmd.com/health-conditions/f/multiple-sclerosis/40294/naturalpathic-treatment-for-ms,Naturalpathic treatment for MS,"I've had RRMS for 18 yrs. I have all the same med issues that most people with MS have. I don't do conventional treatment. I've never been on any MS drugs. All my treatment has been Naturalpathic. I do weekly deep tissue massage, acupuncture, use the TENS unit, alternate hot/cold and walk which is the only exercise I can do. I use med Marijuana (CBD) in the form of oil under your tongue & I use a Marijuana pain relief balm that I rub on painful areas which really does take away pain. The mgmt that my NMD has put me on for my MS has helped me immensely. When something doesn't work any longer, a change might be productive.",
Multiple Sclerosis,https://messageboards.webmd.com/health-conditions/f/multiple-sclerosis/41997/career-and-ms,Career and MS,"I am a 21 year old Male who suffers from daily painful attacks in my legs that keep me having issues with walking along with extreme fatigue, blurry vision and numbness on the left side of my body. My job is a team leader for a program called AmeriCorps NCCC FEMA Corps, where I go around helping those recover from disaster. I have 4 subordinates and I live and work with them at all times. But since my symptoms started appearing in October of 2017, roughly about two weeks before my 21st birthday, I've run into numerous issues with going to work and having the ability to stay till the end and I continuously worry that I'm going to lose my job over my ability to work through my issues. My corps members, my subordinates, don't know about this and they resent me for missing work a few times due to what they perceive as laziness, which hurts a lot honestly because if I tell them the truth they will request to my leadership that I be forced to resign. I say this seriously as a similar situation happened to another team leader at the beginning of my service term. I am currently going to physical therapy this coming Friday and will more than likely be issued a cane in the coming days as I need one to walk at the moment. I just wanted to share my experience and say I hope we all get through this.",
Multiple Sclerosis,https://messageboards.webmd.com/health-conditions/f/multiple-sclerosis/39580/ocrevus,Ocrevus,I am taking Ocrevus infusions every six months and it's making a noticeable difference. I would definitely recommend it.,Treatment
Multiple Sclerosis,https://messageboards.webmd.com/health-conditions/f/multiple-sclerosis/48820/seizure,Seizure,I am curious as what to expect following seizures required hospitalization for someone who had MS and just switched to a new medication 2 mo ago TYSABRI. She was taken by EMS Friday @ 6:30 pm. I am her sister and I am inquiring on what improvements should be occurring with in 64 hours so far? She is in NC and I am here in KS.,"Living & Managing , Symptoms , Treatment , Diagnosis"
Multiple Sclerosis,https://messageboards.webmd.com/health-conditions/f/multiple-sclerosis/49639/ms,MS,How long did it take to diagnose MS? I have been going to doctors for 2 years now. I have another MRI tomorrow. I need to find out. Its driving me crazy!,Diagnosis
Multiple Sclerosis,https://messageboards.webmd.com/health-conditions/f/multiple-sclerosis/49438/gilenya,Gilenya,Just started taking Gilenya was wondering if anyone has had side effects from this med was on Tecfdarea but blood count was to low,
Multiple Sclerosis,https://messageboards.webmd.com/health-conditions/f/multiple-sclerosis/58350/mother-diagnosed-with-ms,Mother diagnosed with MS,"Multiple Sclerosis (MS) is definitely an unpredicted disease which affects the Central Nervous System (CNS). More than 2.5 million people is affected across the world. It is a slow progressing autoimmune disease triggered by demyelination of the nerve cells. The disease usually starts when the immune system short circuits and starts attacking the body, particularly, nerve cells or neurons. The immune system releases T-cells which migrate towards nerve cells and cause localized inflammation on the myelin sheaths surrounding the cell. Myelin sheath is a fatty layer around the axon part of neurons that enables neurotransmitters to pass through. Well, I started to search on this after my mother was diagnosed with MS. She was prescribed compound medication from a medication consultation in Toronto(   ), which has been effective on her. The inflammation has reduced. After some research on this, I have come to know that Spirulina is one of the supplements that many MS recovery patients take. It is a strain of edible algae which is specially bred. Does anyone here know about this? Do you recommend this for my mother?  Any suggestions regarding this are welcome Thanks in advance!",Living & Managing
Oral Health,https://messageboards.webmd.com/health-conditions/f/oral-health/70168/invisible-braces,Invisible braces,"This wasn’t my first experience with braces since I had the traditional metal orthodontic braces when I was a teen.   I wore it almost a year. My teeth were perfect after my initial treatment, but I wasn’t diligent about wearing my retainers every night. Eventually, I stopped wearing it altogether since it becomes too painful. I was foolish and I should have been more responsible. My teeth ended up shifting tremendously over the next decade, which taught me a good lesson that I’ll never forget. In my early 20s, I was dealing with an open bite and my top front teeth became crowded and pushed out slightly. I was embarrassed because this could have been prevented and I felt self-conscious about my smile. I didn't want to put on the normal metal braces again. Unwillingly but scared I went to the doctor. I opened up to him. He laughed and told me it's all too common these days. I was relieved. He suggested about the invisible braces that is done on the tongue side. Without second thoughts I agreed to it. I knew the cost is high but I had to choose it because this was what I longed for. Can I get suggestions from anyone who has experienced this?","Dental Procedures , Tooth Problems"
