disease,postLink,postHeading,postContent,postTags
Mental Health,https://messageboards.webmd.com/health-conditions/f/mental-health/67675/overwhelmed,Overwhelmed.,"It's been a familiar humour that my family and I must be made of steel due to our unfortunate luck. I had never really recognized what I had been dealing with before I ended up having several mental breakdowns- which brings me to my ultimate depression recently. My partner and I have been going through a battle with finances due to losing a job post injury. We've been stressing over whether we'd have enough to eat for the day and living paycheque to paycheque. This wasn't something we were unfamiliar with- and we made it work.  Through this we lost our home and we are currently battling our old land Lord who is trying to take advantage of us for more money. We are currently back home with family.  Just this past year my family had been helping with the severe health problems of my grandmother - who had ended up in the hospital for the majority of the year. It wasn't an easy thing to see my best friend unconscious on a hospital bed anticipating that she might leave me at any moment. I'm sure most of everyone can fathom this situation, because it is not all that uncommon. When comes financial and medical stress, relationship problems follow. It came to the point where I wasn't performing my full potential at my job, and the overstimulation from anxiety and racing thoughts was keeping me in bed until late hours on my days off.  Luckily I found therapy in my job - working with animals. Most nights I would stay late to provide extra care for the animals, which I truly see a blessing.  I found myself staying particularly late one night - I laid down in a kennel with a dog that I sensed needed some compassion and began brushing her and helping her fall asleep. I then got a call. The kind that knots your stomach. These phone calls don't require any indication of topic or specific details, just the ""are you sitting down"" and the deep sigh from the other end. I rushed to my parents house and demanded to know what was wrong as soon as I entered the house. My parents are my best friends - we have always been a bullet vest kind of family, no matter what we stand up to the challenges together. This one was a lot harder. My mother was diagnosed with breast cancer.  I could go into the gut wrenching detail of the emotions that were to follow; and the days of lying in bed listening to music that reminded me of my childhood but it all comes down to the same thing. They say that you're only given as much as you can handle... I don't know if that's true anymore. Is that just something people tell themselves when life becomes something you read in a fictional novel that gets the tears jerking? All I can say is I don't know, but I'm going to try to be the strongest yet for the most important woman in my life; even if that's something I cannot do for myself.",Depression
Oral Health,https://messageboards.webmd.com/health-conditions/f/oral-health/48680/mass-of-sores-all-over-my-mouth,Mass of sores all over my mouth ????,"I have these blister looking sores all over the inside of my lips and my cheeks.. some type of bump on my gums where they meet in the very back making it hard to open my mouth. I also have bumps all over my tongue, the sides are covered. The bottom is covered. I have a few on the top and some will go away but I will have like 6-8 more pop up. I cannot eat anything without crying and it burns slightly just to even try to drink water.. at this rate it seems like it will never go away. What is going on",Mouth Problems
Oral Health,https://messageboards.webmd.com/health-conditions/f/oral-health/36099/i-cant-drink-cold-drinks-or-even-breath,I cant drink cold drinks or even breath,Whenever i breath my front teeth start killing me its kinda broke and im afraid of going to the dentist what can i do,"Dental Procedures , Tooth Problems"
Oral Health,https://messageboards.webmd.com/health-conditions/f/oral-health/47883/help-with-bump-in-mouth,Help with bump in mouth,"On the roof of my mouth I have a bump that’s filled with pus and it came after I started taking hydrocodone for pain because I had a abscess, after taking the hydrocodone I also noticed my throat started to hurt and now it’s red and hurts to swallow.. please help me identify what this is and what I need to do to get rid of it, I’ve been taking antibiotics also, even before this formed.","Dental Procedures , Mouth Problems"
Multiple Sclerosis,https://messageboards.webmd.com/health-conditions/f/multiple-sclerosis/922/newsflash-ms-drug-used-early-may-reverse-some-disability,Newsflash: MS Drug Used Early May Reverse Some Disability,"A multiple sclerosis drug usually reserved for people in the late stages of the disease seems to offer long-term remission in newly diagnosed patients.  Click here to read more:    Reply and tell us what you think of this news. How does this make you feel about the future of MS treatment?  Note to Readers: If you want to join this conversation, sign in (or sign up to be a WebMD member). See the link in the upper right corner of this page. Thanks!","Living & Managing , Symptoms , Treatment , Diagnosis"
Multiple Sclerosis,https://messageboards.webmd.com/health-conditions/f/multiple-sclerosis/1313/powerful-ms-medication-lemtrada-may-reverse-disability,"Powerful MS Medication, Lemtrada, May Reverse Disability","Last year the FDA approved Lemtrada for the treatment of relapsing forms of MS. It is a powerful drug that is reserved for people who have not responded to other MS medications. Some clinicians have referred to it as Stem Cell Transplant ""light"" because it wipes out and reboots the immune system.  You can read the details from Medline here:",
Mental Health,https://messageboards.webmd.com/health-conditions/f/mental-health/67180/replying-about-insomnia,Replying about insomnia.,I have quite a problem with racing thoughts too. The only way i can turn them off is concentrate on something else. So i meditate on relaxing my body part by part. I am asleep in minutes. It takes time but you are training your brain not to think  on your fears.,Depression
Oral Health,https://messageboards.webmd.com/health-conditions/f/oral-health/42314/one-sided-throat-pain-for-1-year,One sided throat pain for 1 year,"i had this dull pain in my throat for almost one year now , it never subsides . i went to many ENT , the first said that he sees nothing , the second said allergies , the third one said that i have to remove my right tonsil , i dont know what to do anymore please help me im feeling desperate because now i have difficulty speaking , i feel vibrations in my right throat when speaking and its so annoying and painful , anyone who can help me , ill be so grateful !",
Oral Health,https://messageboards.webmd.com/health-conditions/f/oral-health/42854/bruise-feeling-on-neck-under-chin,Bruise feeling on neck under chin,"Woke up and if I touch the area of my neck under my chin, it feels like a bruise but I don't see a bruise there. I'm also having some pain in my jaw and tooth area?",Mouth Problems
Multiple Sclerosis,https://messageboards.webmd.com/health-conditions/f/multiple-sclerosis/1286/questionable-ms,Questionable MS?,"I recently experienced stroke-like symptoms including numbness/tingling, headache, eye pain, excessive sweating, dizziness and vertigo, etc. My MRI showed multiple areas of high foci peri-ventricular white matter and stated ""cannot exclude demyelination"". What are your thoughts? Might I have MS?","Symptoms , Diagnosis"
Oral Health,https://messageboards.webmd.com/health-conditions/f/oral-health/43572/sudden-excessive-salivation,Sudden excessive salivation?,"I occasionally experience sudden, unexpected episodes of excess salivation, each of which lasts about five minutes and is accompanied by nausea, sweating, tingling in the cheeks and lymph node areas, and occasionally chills. I swallow or spit the excess saliva every ten or so seconds, each of which I would say amounts to about a teaspoon's worth. After the episode I feel fine, albeit a little sweaty and uneasy. I wouldn't say I feel dehydrated afterward, but I hydrate well every day. I have no idea what brings this on, but it usually happens outside with no warning. These episodes happen with no predictability; I've gone months (up to about a year) without experiencing it but I've also had episodes days apart. Thinking about it makes me stressed out, which can sometimes cause the sensation I feel during episodes (tingling cheeks, jaw, glands).",Mouth Problems
Mental Health,https://messageboards.webmd.com/health-conditions/f/mental-health/67181/i-have-quite-a-problem-with-racing-thoughts-too-i-can-turn-them-off-by-concentrate-on-meditation-on-relaxing-my-body-part-by-part-i-am-asleep-in-minutes-it-takes-time-but-you-are-training-your-brain-not-to-think-on-your-fears,"I have quite a problem with racing thoughts too. i can turn them off by concentrate on  meditation on relaxing my body part by part. I am asleep in minutes. It takes time but you are training your brain not to think
 on your fears.",Replying about insomnia.,Depression
Mental Health,https://messageboards.webmd.com/health-conditions/f/mental-health/42615/xanax-withdrawal-related-to-heart-rate,Xanax withdrawal related to heart rate,am currently tapering to get off Xanax. I have been tapering for 6 months and have .25mg a day left which I take before bed and when I wake up. My symptoms are generally mild compared to other stories but the fear and anxiety is what slows down my tapering speed. I know some of the symptoms are made worse by the anxiety I create on top of the actual symptoms. I know heart rate increased during withdrawal so my question is can I monitor my withdrawal symptoms by checking my rate. For instance if my usual rate is 70bpm normally can I use this as an indicator to know whether or not my body is withdrawing more. So if my heart rate is normal would it be safe to say I am generally ok to continue tapering that day. I just need help to know there is some kind of baseline to distinguish real symptoms from what I create out of my own fear. Thanks.,"Anxiety & Panic Disorders , Substance Abuse"
Mental Health,https://messageboards.webmd.com/health-conditions/f/mental-health/65858/help,Help,"Hi. I need help, I have suicidal thoughts everytime and I need someone to talk to.... please help!!!","Depression , Self Harm , Bipolar Disorder"
Mental Health,https://messageboards.webmd.com/health-conditions/f/mental-health/65863/fears-and-nightmares,Fears and nightmares,I've never done this before so I hope I'm doing this right. I'm a 39 year old male who has been dealing with some serious health issues since 2013. That's when I found out I had severe diabetes and found out at the hospital. I went on because I thought I had the flu. I found out there that I had diabetes and had some gangrene. The ER doctor told me I had 2 days left to live. I was admitted and had 7 major surgeries in 11 days saved my life. I was hospitalized for 33 days. I came home and had to relearn how to walk again. Moving forward to 2016 and I again had gangrene in my foot. I ended up with MRSA and an amputation below my knee. 2015 I went blind in my left eye and contracted Chronic kidney disease. This year in April I got really sick. I went to the hospital and was told that I had a heart attack sometime in the past. I didn't know it or felt it. I was sent to a different hospital that had a great cardiologist there. I found out there that I had to have a triple bypass surgery. I went through that and they cleared out 97% of the blockage. I live alone so they thought I would be better off in a nursing home and rehab center. The surgeon sent me there 5 days after the surgery. I was at the nursing home for about 5 days and went into heart failure. I was rushed back into the hospital and had to take a few dialysis treatments because I had went into renal failure. They gave me 2 blood transfusions. I was sent back to the nursing home to restart my physical therapy. Altogether I was gone from home for 5 months. I've been having nightmares every night about surgeries and dying. It has made me to the point I'm scared of going to the doctor's office or the hospital for anything. I feel stupid talking about this but I need help to get over it.,"Anxiety & Panic Disorders , Depression"
Mental Health,https://messageboards.webmd.com/health-conditions/f/mental-health/67006/i-dont-know-anymore,I dont know anymore,"I hurt so bad inside right now. I dont want to die but I dont see the point in living anymore. This scares me. I have a great group of friends I could talk to but I just cant. I dont know how anyone would react and I dont want to be a burden to anyone. I dont see the purpose of life anymore. It all seems useless and pointless. Im spiraling out of control right now. I honestly dont think I would ever try to commit suicide, but my brain is so messed up right now I dont know what I could possibly do. I just dont want to feel like this anymore. I dont like talking to people but I know I should start talking. I have no idea where I would start. Please someone help me",Depression
Mental Health,https://messageboards.webmd.com/health-conditions/f/mental-health/61761/a-dangerous-situation-time-is-of-the-essence,"A dangerous situation, time is of the essence.","I’m 23 years old my brother is now 19. My brother has always struggled from depression and anger. He has always been very destructive towards my moms house with holes in the wall from punching and stabbing it. He was kicked out about two years ago because we’ve always somewhat feared him and my mom couldn’t take it anymore. He would collect knives, swords and hatchets from online which made me nervous, so I put a deadbolt on my room door. He has threaten to kill us both on numerous occasions... recently he has started to come by my moms house a lot more often as his current living situation with friends has fallen through as I’m sure they see how he truly is. My mom noticed about a week ago that one of her guns is now missing. He is the only one that knows how to use them and where they are generally kept. He has been extremely Suicidal and irrational and on top of it I think is on multiple drugs. He seems to come here on his come down when he’s violent and sleeps here for 12+ hours on the floor or couch. I have a 6 months old daughter now living here and I know it’s a hard choice for my mom but I think it’s time to call the police. He has full access into our home, I won’t sleep until that gun has been found. I told him to leave the house and would not allow him to stay here for the abusive language, and hostility he was bringing around my daughter. I feel like he will resent me more for this. I’ve never been able to bond with him like my other sibling. It’s almost as if he doesn’t have a soul or feel anything for anyone. I need to tred lightly and approach this the safest way possible. I know he won’t seek treatment willingly. My sister, mother and I all fear he is capable of this. He’s always remind me of a murder.... you just can’t ignore the signs. He lost all interest in activities, he’s never had a real girlfriend or relationship. I want to get him the help he needs and the security that Our family deserves.","Anxiety & Panic Disorders , Depression , Schizophrenia , Self Harm , Substance Abuse , Bipolar Disorder , Personality Disorders"
Mental Health,https://messageboards.webmd.com/health-conditions/f/mental-health/67193/help,Help,"I am struggling. My dad just died and I think I an depressed. I have insomnia and am constantly anxious. I can’t focus on anything. I don’t want to burden my family after the loss of my father after his battle with cancer. I am not suicidal but, I think the depression is getting worse.",Depression
Multiple Sclerosis,https://messageboards.webmd.com/health-conditions/f/multiple-sclerosis/575/using-handicap-parking-spots-when-living-with-an-invisible-illness,Using Handicap Parking Spots When Living with an Invisible Illness,"I thought this was a particularly interesting, and true, post from the National MS Society's Blog. The author discusses what it's like to use a handicap parking spot when you have an invisible illness, and the judgement and even bullying that you may experience as a result-     ""Have you ever been in a situation where you park in a disabled stall and then act worse than you feel when you get out of the car? I know I have. It stinks, too, because I feel like I need to ""look the part"" if I don't want to be judged.""",Living & Managing
Multiple Sclerosis,https://messageboards.webmd.com/health-conditions/f/multiple-sclerosis/574/stretching-and-range-of-motion-exercises-for-spasticity,Stretching and Range of Motion Exercises for Spasticity,"Stretching and maintaining your range of motion is very important when you have MS, especially if you are like me and struggle with spasticity. I love the National MS Society's brochure on stretching because it walks you through very simple exercises that you can do anywhere to keep yourself in shape! You can view and print the brochure here:","Living & Managing , Symptoms"
Multiple Sclerosis,https://messageboards.webmd.com/health-conditions/f/multiple-sclerosis/633/i-have-a-knot-on-my-foot-and-it-is-painful,I have a Knot on my foot and it is painful,I was DX in 2005 with MS. My last Neuro Appointment went well and he said I was in Remission..BUT..What is done ..is done. And I was wondering ..I have a knot that came up on my right ankle .It is very painful. Does anyone else have this problem? thanks,Symptoms
Multiple Sclerosis,https://messageboards.webmd.com/health-conditions/f/multiple-sclerosis/627/sex-and-ms,Sex and MS,Is it possible? My husband and I haven't been intimate in over a year. We're losing our spark....I want to nurture our relationship while I still can. I know this is a touchy subject but I really could use some advice.,
Multiple Sclerosis,https://messageboards.webmd.com/health-conditions/f/multiple-sclerosis/729/newsflash-exercise-may-not-lower-women-s-risk-of-ms,Newsflash: Exercise May Not Lower Women's Risk of MS,Here's a new news story for members and readers on this message board:   .  Reply and tell us what you think about this news. Sign in (or sign up to become a WebMD member -- see link in the upper right corner of this page) and share your thoughts.,"Living & Managing , Symptoms , Treatment , Diagnosis"
Multiple Sclerosis,https://messageboards.webmd.com/health-conditions/f/multiple-sclerosis/806/how-to-recognize-and-manage-speech-and-swallow-symptoms,How to Recognize and Manage Speech and Swallow Symptoms,"Has MS affected your voice or ability to swallow? It's a common issue, and there are several strategies to improve both speech and swallowing difficulties. Speech MS can cause a couple different vocal issues. Dysarthria is slow, slurred, or quiet speech that is a result of poor or limited articulation. Dysphonia causes your voice change making it sound harsh, hoarse, overly nasal, or breathy. Most people take the ability to talk for granted, which can make it seem like a fairly straightforward task. However, speaking requires 100 different chest, neck, jaw, and facial muscles to work in synch. If the nerves to any of these muscle groups, or the movement of the vocal cords are affected by MS you may not be able to speak as eloquently as you once could. In most cases an evaluation by a Speech Language Pathologist (SLP) is recommended, and can be extremely helpful. They can take a careful look at how all those muscles are moving and your breath control. Then, just like a physical therapist, they can suggest exercises to strengthen the muscles that control speech.  Swallowing The same muscles that you use when you speak are also responsible for swallowing. Difficulty with initiating a swallow, choking, coughing while eating or drinking, or frequently clearing your throat during meals can be warning signs of a swallowing disorder (dysphagia). This is a potentially life-threatening issue because it can lead to choking, or even aspiration pneumonia. If you think you are experiencing dysphagia you should bring it to the attention of your neurologist immediately, and once again they will probably recommend an evaluation by a Speech Language Pathologist (SLP). Your therapist can do a couple of diagnostic tests to pinpoint your issue, and come up with a personalized treatment plan. There are several strategies for managing dysphagia such as slightly tucking your chin, alternating a bites of food with sips of liquid, and swallowing each bite twice can greatly reduce the risk of choking. Therapists can also recommend the right amount and consistency for food and liquids for you. It is also important to always eat and drink while sitting straight up, keep your tongue and teeth as clean as possible to reduce the bacteria in your mouth, and to take a break if you feel fatigued at mealtime.","Living & Managing , Symptoms"
Multiple Sclerosis,https://messageboards.webmd.com/health-conditions/f/multiple-sclerosis/623/deep-brain-stimulation,Deep brain stimulation,"My doctor is suggesting deep brain stimulation. I don't know if I should go ahead with it. Are there any harmful side effects? Does it hurt? A friend of mine said that the FDA hasn't approved of this yet and it's really concerning me. I feel like I could be doing more harm than good. Since there's no cure, I don't know if this is just a money making scheme for physicians.","Living & Managing , Treatment"
Oral Health,https://messageboards.webmd.com/health-conditions/f/oral-health/40030/saliva-build-up-and-difficulty-talking,Saliva build up and difficulty talking,"Hi, so this has been going on for a year and starting to interfere with my daily college life and giving me depression. So my left cheek feels tight and difficult to move and it feels like there’s a lot of saliva built up on the left side. It becomes extremely difficult to talk and speak clearly and I have to put a lot of effort in to get my words out clearly. My left cheek also seems swollen compared to my right cheeck from the inside. Please help!","Mouth Problems , Tooth Problems"
Oral Health,https://messageboards.webmd.com/health-conditions/f/oral-health/40747/tonsil-stones-or-hole,Tonsil stones or hole?,"So I’ve been suffering from tonsillitis for a few days with pain especially in the left side of my throat and have just noticed what looks like a black hole on the left side of my throat, I thought it could be a tonsil stone but looks just like a hole to me, does anyone know what this is? Or am I being stupid and is it meant to be there? Any answers appreciated",
Oral Health,https://messageboards.webmd.com/health-conditions/f/oral-health/40333/lips-changing-and-disappearing-by-the-day,Lips changing and disappearing by the day,"I am 27 yrs old, not a smoker, my lips are 100% natural. For the past two weeks, my lips have been getting smaller daily(I've been taking pictures to track this), major volume loss, shape change, and dropping on both sides (but one side much greater). The side that is dropping more is also losing volume at a faster rate. I've also had pain for only a few days of the jaw muscle on the same side, but not sure if that has anything to do with my lips disappearing. What disease/disorder could possibly cause this?",Mouth Problems
Oral Health,https://messageboards.webmd.com/health-conditions/f/oral-health/39808/tooth-abscess-treatment-working-or-not-working,Tooth Abscess...Treatment working or not working?,"Yesterday I went to the dentist due to a very (very) painful tooth that would not quit throbbing. I was diagnosed with a tooth abscess. After taking two doses of antibiotics (I am taking 500mg of penicillin every 6 hours - 3 doses, thus far), the lump at the back of my tooth had reduced a bit, the throbbing was tolerable, and I had hoped the medication was working. Placebo effect is possible, too, of course. This morning, however, I woke up to find no lump directly above the tooth, but pressure and swelling just below the apple of my cheek. I've never had an abscessed tooth like this before. Is it possible the infection has ""spread"" or is this just a normal progression and sign the antibiotics are fighting whatever infection was already in that area?","Mouth Problems , Tooth Problems"
Oral Health,https://messageboards.webmd.com/health-conditions/f/oral-health/41765/roof-of-mouth-white-and-throat-is-veiny-should-i-be-worried,"Roof of mouth white and throat is veiny, should I be worried?",What is stated above and I don’t feel sick nor does my food taste weird or do I have throat soreness. Should I be worried?  Post to photos (too large to upload):,"Dental Procedures , Mouth Problems"
Oral Health,https://messageboards.webmd.com/health-conditions/f/oral-health/42001/laser-periodontal-therapy-or-conventional-treatment,Laser periodontal therapy Or Conventional treatment,Hi every one. I am suffering from Gum disease. I used to keep it untreated. But its high time to treat as its resulting swelling and bleeding. And being diabetic is another big deal I am facing. I was planning to under go conventional treatment for the gum disease. I came to read about Laser periodontal therapy provided by a clinic in Mississauga (   ). An advantage of using laser therapy to treat periodontal disease is that it is antibiotic free and gets directly at the source of the bacteria causing the infection in your mouth. I am not knowing much about this. Is there any complications related to it?,"Dental Procedures , Mouth Problems , Tooth Problems"
