disease,postLink,postHeading,postContent,postTags
Mental Health,https://messageboards.webmd.com/health-conditions/f/mental-health/85542/confused,Confused,"I'm a 16 year old female and in college. I'm confused and don't know if I have depression or any mental health issues or if this is something else.  I have symptoms such as having to constantly search for a reason to get up from bed, at anytime (having to go to class usually ends up being the reason but sometimes thats also not enough), I never have energy and have had this headache most days for over a year now, I have no interest in any activities whatsoever except language learning, watching videos on youtube & facebook watch, reading stories surfing the internet, social media included and listening to music. I avoid social situations and interactions as much as possible, and only want to eat & sleep. I do try to participate in class but I can never concentrate and always feel like any little contribution I make is useless. I never participate in group activities (except presentations) and always do my part on my own. I do get quite apathetic and just feel like ""sure whatever"" about everything. I have a very hard time making decisions and always go with the most familiar option on anything. I always feel like I'm on autopilot and just do what I have to, I get super fidgety and restless whenever I'm in the presence of other people and sometimes can't breathe properly (but never enough to panic). I sometimes (rarely though) think about suicide and long to feel the sting of a blade but I don't act on that urge, mostly because I'm a coward and always too drained and tired to care about actually doing any of it. But I'm not sad all the time, I mostly feel neutral I guess. I'm attached to alot of things and have people I don't mind seeing and chatting with (never actively seek them out but if we bump into each other, sure why not). I ALWAYS find something to do like sleep, watch videos, listen to music etc so that I have something to feel and react to and not have any time spare time to get into my thoughts because I loathe the negative thoughts that never seem to leave. I'm actually a teensy bit bubbly & quite smiley if need be (but thats just me I guess). There are things that make me laugh, cry, want to chuck my phone across the room & feel happy, giddy, sad, angry etc but most of it is online stories and videos. I always have an automatic smile when I say hi or talk to someone and sometimes it feels genuine. Even if I feel hopeless, like I'm wasting my life and get real apathetic about school work, I still try to get good grades. I'm confused if all this is just my personality and me overthinking or if it's something more.",Depression
Mental Health,https://messageboards.webmd.com/health-conditions/f/mental-health/85472/depression,Depression,"To everyone else, I am a happy-go-lucky 22 year old who rarely isn't smiling which is a burden to take on. On the outside I put on such a front that no one realizes that I feel empty, like I have no purpose, that the world would be better off without me. I often wonder how much simpler things would be if I weren't around anymore but I know what that does to families. I hide my depression so well that even my own fiance doesn't notice my moods. I weep in the shower, I can't focus at work because I am too busy thinking about how empty, sad, and unhappy I am. The first thing I do when I get home from work at 5 o'clock is crawl into bed and I don't move from that spot for the rest of the night. I have no quality of life anymore and I just don't know what to do. I'm exhausted 24/7. Nothing feels right anymore. I believe I am too young to feel like this. But unfortunately, I do.",Depression
Mental Health,https://messageboards.webmd.com/health-conditions/f/mental-health/47502/lithium,lithium,hi am new here has anyone been on lithium for depression ?,"Anxiety & Panic Disorders , Bipolar Disorder"
Mental Health,https://messageboards.webmd.com/health-conditions/f/mental-health/85579/depression,Depression,"Ive been struggling to much lately. I feel like I have nothing to live for. No one around me cares about me the way I care about them and I’m just so tired of everyone using me. The only person I can talk to is my therapist, but its not the same. I don’t know how long I can continue to pretend that I’m okay. And I cant tell my therapist about me being suicidal because I dont want to deal with having to tell my family. Its embarrassing and I have so much anxiety about talking about it when them so i’d rather suffer.",Depression
Mental Health,https://messageboards.webmd.com/health-conditions/f/mental-health/85716/medication-juggling,Medication juggling,"Everyone and every case of bipolar is different. Diagnosed in 2013. I've been on so many different medications, and suddenly all the meds I've used for the last 5 years have quit working... Has anyone else had this happen? I feel like I should find a new Dr. and there are so few in my area. Suggestions?","Anxiety & Panic Disorders , Depression , Bipolar Disorder"
Mental Health,https://messageboards.webmd.com/health-conditions/f/mental-health/85950/alone-with-depression,alone with depression,"Wow, I feel so disconnected. Out of touch with family and friends; I miss my dog, even! Meds are ok but not everything. Music helps at times. youtube videos of dogs just help for a little bit. I like me but does anyone else? Everyone is so damn busy.","Anxiety & Panic Disorders , Abuse Victims , Depression"
Lupus,https://messageboards.webmd.com/health-conditions/f/lupus/26053/ana-positive-with-centromere-pattern,ANA positive with  Centromere pattern,After my ana got positive doctor performed the below. All my other tests are normal Dsdna negative c3 c4 normal . Doctor started hcq as the treatment due to the ATT treatment is still onging.( he started off anti tb drugs for the Puo with skin test positivity) Do I have lupus or crest.,
Lupus,https://messageboards.webmd.com/health-conditions/f/lupus/7105/benlysta-for-lupus,Benlysta for lupus,"Just had my 2nd Benlysta treatment, took me 2 years to agree to try this drug. So far everything is going well. Just looking for some first hand experiences with this drug. Is it going well for you or not? I live in a small community and my rheumatologist has only 1 other patient on this drug that I know about.",
Lupus,https://messageboards.webmd.com/health-conditions/f/lupus/18880/swollen-lymph-nodes,Swollen Lymph Nodes,"I'm 53yo, with Lupus and just had my infusion last Friday. Sunday, I noticed a lump below my right ear, the size of a pea that was tender to the touch. Today, the lump grew the size of a small pebble, and still tender to the touch and it hurts quite a bit when I raise my head. I recently had been nursing a head cold and just been getting over it. I never had experienced a swollen lymph node before. Can you tell me what this is all about and why this happens? Should I monitor the growth? I don't see my specialist for another three weeks.",Symptoms
Lupus,https://messageboards.webmd.com/health-conditions/f/lupus/7394/alternative-meds,Alternative Meds?,"I have read many articles suggesting highly concentrated cannabis oil can be effective and alternative meds for people suffering with lupus. Pain and inflammation are two commonly recognized therapeutic properties of cannabis, so its ability to treat lupus effectively is not surprising. Like this article about chronic inflammation from   . Let me also hear your thoughts or personal experience when it come with medical marijuana. Thanks",Treatment
Lupus,https://messageboards.webmd.com/health-conditions/f/lupus/7484/may-is-lupus-awareness-month-here-s-what-you-should-know,May Is Lupus Awareness Month. Here’s What You Should Know,"Lupus is a lifelong disorder of the immune system, and it affects women 10 times more often than men. While the symptoms of lupus may be limited to the skin, more often lupus also causes internal problems and in severe cases can damage the heart, kidneys, and other vital organs.  When lupus begins it can look a lot like rheumatoid arthritis, which causes joint pain and swelling, or fibromyalgia, which causes fatigue and pain. Find out what sets it apart, what puts you at risk, and how you can reduce lupus flare-ups if you’ve been diagnosed, here:    Are you living with lupus? What were the symptoms that lead to your diagnosis?","Exercise , Diet , Living & Managing , Symptoms , Treatment , Diagnosis"
Lupus,https://messageboards.webmd.com/health-conditions/f/lupus/8071/what-you-should-know-about-lupus-treatments,What You Should Know About Lupus Treatments,"Although there’s no cure for lupus, there are treatments and lifestyle changes that can help you manage your symptoms. Treatments can help ease your symptoms, bring down inflammation, prevent and relieve flares, and prevent organ damage and other health problems.  What types of treatment available to you depends on your symptoms and how severe they are. Here’s a quick overview of treatments as well as lifestyle changes that could help:",Treatment
Lupus,https://messageboards.webmd.com/health-conditions/f/lupus/8445/how-do-you-manage-your-lupus,How Do You Manage Your Lupus?,"Whether you’re an adult dealing with your own diagnosis or the parent of a child with lupus, you have challenges to face every day. Throughout Lupus Awareness Month we’ve talked about how lupus is diagnosed, the symptoms to look for, what questions you should ask your doctor, and what treatments may help you manage your symptoms. Today we’re taking a look at tips to help you live well with and manage those everyday challenges that come with having lupus.  So, take a look at these articles that cover everything from skin care tips and diet to the emotional impact of living with lupus to lupus and pregnancy:",Living & Managing
Lupus,https://messageboards.webmd.com/health-conditions/f/lupus/4259/drug-induced-lupus,Drug-induced lupus,"Has anyone ever been diagnosed with DIL (drug-induced lupus)? A few years ago, I began having lupus like symptoms that caused a lot of dysfunction in my life for over a year, and I had a positive ANA test. I was referred to a rhumetoid specialist but he only thought it was something other than lupus and yet never gave me any other diagnosis after many many many tests, referrals, etc. I have had a healthy year now since then but feel at times as if I could be experiencing those symptoms again. I was wanting to know more about drug induced lupus and exactly what that can consist of. Does it go away after so long? Are there certain drugs to cause this induction? Thank you!","Symptoms , Diagnosis"
Lupus,https://messageboards.webmd.com/health-conditions/f/lupus/28468/drug-induced-lupus-erythematosis,Drug induced lupus erythematosis?,"Hi, I am a 27 year old female and I wanted to know if it was possible for me to have developed DILE. After reading up on this condition in online medical journals, it seems to be the only thing that makes sense. The only unlikelihood of this is that it typically affects women over 50. I started taking Wellbutrin XR about 3 and a half months ago and started experiencing on and off low-grade fevers, fatigue, terrible joint and muscle pain, along with swollen lymph nodes a couple times. I usually only get sick about 3-4 times a year and I started getting ""sick"" every two weeks, then every week, then almost every day. I have never experienced this in my life so I went to get blood tests done and everything came back completely normal and I was told I didn't have any cold or flu. The doctor was puzzled and could not come up with any possibilities of a diagnosis. I suspected I was having a bad reaction to the Wellbutrin so my psychiatrist has put me on a taper plan to get off this medication (I have 4 days left). This morning I woke up in tears because the joints and muscles in my arms and hands were hurting so bad they felt like they were on fire. I am hoping these symptoms will subside after discontinuing the medication. Unless my symptoms become worse and do not away, I don't think there will be any point in going back to the doctor. Has anyone else experienced this from a medication? I know there are four medications that have been proven to cause this and there are at least 50 more medications that have been reported to cause it (Wellbutrin being one of them) but not actually proven. Luckily, if I do have this condition it is said to completely go away after stopping the medication.","Symptoms , Diagnosis"
Lupus,https://messageboards.webmd.com/health-conditions/f/lupus/392/could-i-have-lupus,Could I have Lupus?,"Hello, I am a 26 year old male living with a variety of ailments yet to be treated effectively. After extensive research online, I have several reasons to believe that I am one of the few male suspects with lupus.  At age 8, I began losing hair in splotches along the back of my head which would soon be diagnosed as alopecia areata. Shortly after, strange reoccurring rashes began forming along my knees and random places around my arms and neck. These rashes were diagnosed as both a dermatitis and eczema by different dermatologists. These rashes and stints of alopecia have occurred randomly and consistently throughout my life.   At age 14, I began to notice widespread rashes forming on both arms below the line of my shirt sleeves anywhere my skin was exposed to the sun. These rashes continue to occur every spring and summer and slowly retract during the fall and winter months. This was also when I realized the excessive dryness of my hair, scalp and face. I began treatment with certain prescription soaps and shampoos, all of which were unsuccessful. These symptoms still exist today. This was also the approximate time in which the lymph node behind my left ear began swelling at random times, often 3-5 times per month, followed by a feverish feeling up to an hour or two. This swelling and fever still occurs today.   At age 18, I began experiencing crippling depression and fatigue for no apparent reason as I have always been a fairly happy person. These periods of suicidal thoughts, depression and fatigue come about unprovoked and make almost any normal activity impossible. These streaks will come to an abrupt end and I will wake up feeling 100% normal and happy. I was diagnosed bipolar type II by my psychiatrist at age 23 with minimal help from a variety of anti-depressants and anti-psychotics, which I chose to stop taking after 2 years due to fatigue, foggy mind and the risk of dependence.  At age 22, I began experiencing unprovoked chronic low back pain. An MRI showed 2 bulged discs as well as abnormal narrowing of the spine for someone of that age. After 3 epidural injections I was advised to undergo surgery by my primary physician. I was referred to a spine surgeon at OU Medical Center who upon consultation suggested surgery would not relieve much pain as his diagnosis leaned toward osteoarthritis.   At age 25, I lost over 60 lbs in a matter of two months after no change in diet or physical activity. I began experiencing intense reoccurring joint pain in my knees, hips, and hands, especially in the morning and late at night, along with consistent nerve pain stemming from my left buttox down into my quad. Various anti inflammatory drugs were prescribed to subdue the pain, although I soon developed stomach ulcers and rectal bleeding.  Now, at age 26, I continue to deal with all symptoms listed above on either a consistent or reoccurring basis, and new symptoms have emerged. In the last three months, I have started experiencing constant constipation, hemmeroids, rectal bleeding and abdominal pain. The most recent symptom, which began a few months ago, is the ""butterfly"" rash on my face notoriously associated with lupus. It produces redness and elevation of the skin with a burning sensation rather than an itching sensation, lasting several days or up to a week. Lupus seems to coincide the best with my research, but I would like outside opinions.","Living & Managing , Symptoms , Treatment , Diagnosis"
Mental Health,https://messageboards.webmd.com/health-conditions/f/mental-health/85850/not-sure-what-to-do,Not sure what to do,I am a 47 year old female. I have lost my mom four years ago and I have just gone down hill since then. I feel worthless and sometimes like it would be better off if I weren’t here. My daughters are both grown and I have not told them how I feel. I just wish I could be happy again.,Depression
Lupus,https://messageboards.webmd.com/health-conditions/f/lupus/32989/feel-like-dying-slowly,Feel like dying slowly,"I've been tested ANA positive since 2013. Yet not a single doctor (seen 3) since then does anything about it nor cares... ANA positive? Ok great, bye!  My condition has deteriorated greatly! Now I get unexplained attacks that we almost have to go to ER (the only thing that's stopping us is the ER bill). My first time I tested ANA positive : 1:320. No treatment was given. Now I've tested ANA positive (since 2013 - 2017 always ANA positive) 1:160. My current doctor told me : ""No rheumatologist would want to see you with 1:180. It's too low for lupus"". I asked her to give me a referral anyway. I am like my own doctor!  Recently had many blood tests done for C3 and C4 components. : My C4 level is 7661 (normal range 0-2830ng/ml) My doctor told me ""you have very high C4, you suffer from mold toxicity). Ok... I do not work nor live anywhere where's mold! Besides if my home had any mold, my other family members would've been sick! But I am the ONLY ONE who's sick and getting sicker by the day! My C3 is elevated as well but slightly. Do patients with lupus have high levels of C3/C4 or patients with lupus have lower numbers generally for C3 and C4 components?  I feel like I am helpless. Nobody cares no wants to help me. I don't know anymore what doctor to see. Nowadays I feel when my face is getting swollen, my neck and my lymph nodes on my neck. Please help to clarify what high concentration of C4 could mean? Thank you.","Living & Managing , Symptoms , Treatment , Diagnosis"
Mental Health,https://messageboards.webmd.com/health-conditions/f/mental-health/85209/trazodone-and-gaba-l-theanine-supplement,Trazodone and GABA/L-theanine supplement,"Hi everyone, I'm taking 50 mg of Trazodone every night to help me sleep. I used to take some GABA and L-theanine supplemets in the past (before Trazodone) with moderate anxiety-reducing effects. Tomorrow I have important presentation at work and I know I'll be really nervous. I was wondering whether it's safe to take 500 mg of GABA and/or 200 mg of L-theanine before it, given that now I also take 50 mg of Trazodone at night? Thank you.",
Mental Health,https://messageboards.webmd.com/health-conditions/f/mental-health/84847/minneapolis-tv-meteorologist-goes-public,Minneapolis tv meteorologist goes public,"Hey all, I went public with my bipolar 1 diagnosis in. 2012, five years after I got it. Best thing I ever did. Here is a nice piece written by a local paper. The more we talk the less scary it is...the silence and lies will kill you...Ken","Anxiety & Panic Disorders , Eating Disorders , Bipolar Disorder"
Mental Health,https://messageboards.webmd.com/health-conditions/f/mental-health/7819/depression,Depression,Hi IAM Lisa from VA.i suffer from depression.everyday is a stuggle for me.has anyone every tried Zoloft.thanks!,"Anxiety & Panic Disorders , Depression"
Mental Health,https://messageboards.webmd.com/health-conditions/f/mental-health/73547/emotional-abuse,Emotional Abuse,If anyone is dealing with or can help me deal with this issue please respond...,"Anxiety & Panic Disorders , Abuse Victims , Depression , Eating Disorders , Self Harm , Substance Abuse , Bipolar Disorder , Personality Disorders"
Mental Health,https://messageboards.webmd.com/health-conditions/f/mental-health/85237/lyrica-dosage,Lyrica Dosage,Is it good take Lyrica in divided doses (like 75mg 3 times in a day) or 150mg once in the morning.,"Anxiety & Panic Disorders , Depression , Schizophrenia , Self Harm , Personality Disorders"
Mental Health,https://messageboards.webmd.com/health-conditions/f/mental-health/82036/anger,Anger,"Hi, I have no idea where to start. I have a good job, wife and kid. Family is around me. Health is good. Pretty much everything in my life is good. However, I am always angry. At everything. People, objects, events, life overall. I drive with rage. Always in no mood to do anything whatsoever. At work I do feel somewhat comfortable, keeping busy. But outside, I am a mess. I come back home unwilling to talk or do muc. Sit in front of the tv untill I fall asleep. Or just skip the tv and go to sleep. I use sleep as way to avoid talking or doing anything. Not just anger. I overthink and fret everything. I cant stop thinking about my days events when at home. I always think of bad outcomes happening the next day. I am always eager to get back to work the next day to see what would happen. I fall in depression sometime. I don't have many friends. And whoever is already in my life, I do everything I can to make them happy to avoid lossing them. And still I am alone most of the time.  My wife is a kind beautiful person. I am really bringing her down with me. We don't share mcuh in life. Different hopies and interests. I do love her and I want to change for her but I carry a heavy unseen burden on my back.  I am always in a rush to finish everything. And I mean everything. I rushed through school, university, marriage and work. Even when I travel., it feels like some kind of a duty to finish and go back home. I am rushing through life as much as I can. It feels like I want to finish,. Like I am expecting to reacha point where I can just rest, body and mind. In the back of my mind, I know I won't reach such a dream place, I know that I will only rest when I die and be done with the world. I have no idea why I am writing this but I was feeling down and thought I would share a bit. Thanks for reading.","Anxiety & Panic Disorders , Depression"
Mental Health,https://messageboards.webmd.com/health-conditions/f/mental-health/85060/misdiagnosed,Misdiagnosed?,"I've recently been diagnosed with bipolar disorder and I can say I do have symptoms that correlate to the disorder but nothing really seems to add up I guess? I feel like there are two sides of me, a good one and an evil one. The good one obviously does the right things and the bad does some pretty horrible things to me and others. Thing is I can feel the switch, one moment I can be the good one and all of a sudden the bad one lurks in and takes control. It's like I, me, not those two sides, have no control over myself. Those two sides of me have been going at it, fighting over who gets control over my mind and body. It's extremely frustrating because I have so many thoughts running through my mind coming from each of them and they're all coming at me so fast I can't even comprehend most of them. I do things I don't like and I'm fully conscious but because I'm not in control I can't really stop myself. The bad part has recently been coming out so much I fear it'll stay that way and I won't be able to be saved. I don't know what this is or what's happening to me.","Bipolar Disorder , Personality Disorders"
Mental Health,https://messageboards.webmd.com/health-conditions/f/mental-health/85238/natuopathic-with-allopathic,Natuopathic with allopathic?,Is it safe to use both at the same time? or any restrictions..Please advise,Anxiety & Panic Disorders
Mental Health,https://messageboards.webmd.com/health-conditions/f/mental-health/85003/looking-for-help,looking for help,"hi so I don’t really know where to start. I think I’m just at the point where I desperately need to talk to someone about how I am coping because trust me it’s not very well at all. I have depression but I just need some advise and understanding that I can’t get from any friends or family because I don’t want them to worry. I struggle day to day and can’t help but cry to the point that im sick every so often, I don’t eat much and I’m just exhausted all the time. My boyfriend is far away from me and hardly makes the effort to speak to me. I just don’t think he understands at all how hard I’m finding things and he doesn’t get why I’m so upset because to him I have everything, like a perfect family. Despite this I’m just on edge all the time and words can not describe how lonely I feel and how hard I try to help myself not to do something stupid like hurt myself again. People wouldn’t know because I’m a completely different person when I’m alone. I just really need some help and fast to be honest because it’s something that completely changing and ruining everything in my life and makes it not even seem worth living.  if anyone has any advise or can relate what so ever please help me out x","Anxiety & Panic Disorders , Depression"
