disease,postLink,postHeading,postContent,postTags
Kidney Disorders,https://messageboards.webmd.com/health-conditions/f/kidney-disorders/4954/doctor-is-recommending-removal-of-my-kidney,Doctor is recommending removal of my kidney,"And I want to get as many opinions as I can before committing to this. A solid, fibrosis mass showed up on a CT scan. I had the biopsy a cpl weeks ago, but my urologist had to send the samples out to another lab for more testing. Anyway, was looking for some feedback on the biopsy results so far. Should I type out the biopsy results or scan the paperwork?  Thanks in advance.",Kidney Disease
Kidney Disorders,https://messageboards.webmd.com/health-conditions/f/kidney-disorders/4977/ketosis-rhabdo,Ketosis & Rhabdo,"Not sure if this is the correct message board for this or not. I have a history of rhabdomyolysis (2 episodes, 10 months apart), cause unknown. I've recently started the keto diet and have been noticing a few changes (including intermittent pain on L side of lower back, oily film on water after BM). After doing a little research, I've seen mentions of ketosis and rhabdo together, but nothing really substantial. Can the keto diet cause another episode of rhabdo? Should I be worried? *not experiencing any symptoms similar to those I had while in rhabdo",Kidney Failure
HIV/AIDS,https://messageboards.webmd.com/health-conditions/f/hiv-aids/33118/how-you-can-t-get-hiv,How you can't get HIV,"You can’t get HIV by shaking hands or hugging a person who has HIV. You also can’t get HIV from contact with objects such as dishes, toilet seats, or doorknobs used by a person with HIV. HIV does not spread through the air or through mosquito, tick, or other insect bites.","Risk Factors , Living & Managing , Possible Exposure , Symptoms , Treatment , Diagnosis"
HIV/AIDS,https://messageboards.webmd.com/health-conditions/f/hiv-aids/19108/poked-by-needle-stressing-ever-since,Poked by needle. Stressing ever since.,"Sometime in June I was poked by a fresh heroin needle in my mid shin area deep enough to draw blood it was a insulin type needle. I'm worried that I may have contracted HIV through this I took a Oraquick Test at around 4 weeks it was negative and I don't have major symptoms such as fever, night sweats,swollen loses or rashes but I have had a small cough headaches and back pain I'm just wondering if I should be worried or if I'm just over thinking and how accurate was the negative result","Possible Exposure , Symptoms , Home Testing Kits"
HIV/AIDS,https://messageboards.webmd.com/health-conditions/f/hiv-aids/19668/help-me-i-d-these-hiv-stds,Help me I'd these HIV/stds,Diff occasions last 3-4 years please dont pass judgement and If u have idea specifics they aren't from having sex.  I had came in contact with some others piss that went up my nose leaving a small pea size herpe burn that was real sore red o. Year later believe I friend had left her aquafina ChapStick over.weeks after I had uses it looks like maybe lipstick had been on it I noticed a slight burning around the lip area. I had came in contact with more piss Inhalants and broke out with parasite meningitis. My lungs had filled up with white fluid backing up the esophagus maybe 8-12 oz over night and for 2-3 months I had hair like parasites coming back up my throat. Waking up with Luigi's full of hair like stuff. And tested positive at doctor I think herpes. Visited a river and mouth area burned again believe I picked up abreva or a herpes ChapStick medicine. Year later more piss Inhalants or spit and my throat had condom suffocation. I was close to visiting hospital but didnt. Another I believe I had poisoned pizza (syphillis) the suspect and the chin area busted out like bad acne buckshot after eating the pizza. I guess exterior Infection. Another bad piss inhalant this time my lips/mouth got warm stitches and left a genital wart on my lip side. Now 3 times 2-4 month spread I've had these popping back up. I'm somewhat in an abusive correctional facility or under abusive authority.,
HIV/AIDS,https://messageboards.webmd.com/health-conditions/f/hiv-aids/19688/still-paranoid,Still paranoid !,Started having unprotected sex with guy in late march early April. Took 4 generation blood test for hiv in late July. Came back negative. Are these results conclusive ?,
Kidney Disorders,https://messageboards.webmd.com/health-conditions/f/kidney-disorders/2772/i-m-in-rockland-county-nys-on-dialysis,"I'm in Rockland County, NYS on Dialysis",Anyone else in the Hudson Vally with Kidney Failure?,"Dialysis , Kidney Failure , Kidney Disease"
HIV/AIDS,https://messageboards.webmd.com/health-conditions/f/hiv-aids/13436/i-am-loosing-my-mind,I am loosing my mind.,"Gail,This is Somen from Bangladesh.16th july I had protected oral and protected vaginal sex with a low end csw.The sex lasted 20-25 second.From 6 days still today I am running low grade fever maximum 99.2.I have also slight sore throat not severe.Now I am very scared.What should I do now?Does it sound like ARS?",
HIV/AIDS,https://messageboards.webmd.com/health-conditions/f/hiv-aids/19311/little-nervous,Little nervous,"I am a 24 year old female and up until a week ago, I have only been with two men sexually. Yes, only had sex twice. First time we used protection, which was around three years ago.  Anyway, a week ago I met up with a friend I have known for a year. We have talked, sexted etc. I have asked him many times on his health, to which he always answered that he was 100 percent disease free. When we met up, we had unprotected sex. No oral, no anal...just unprotected vaginal sex. He pulled out, and afterwards I texted him again asking about him being sure about being healthy. He responded again that he promised he was healthy. I was not on birth control, so the next morning I visited my doctor and received Plan B to be sure of no pregnancy. I scheduled an appointment for an IUD, pap smear and STI test.  My question is, am I possibly overreacting a bit when it comes to HIV? There is literally no reason to be nervous, but yet I am. He appeared healthy, and I don't see him lying to me for over a year on his health, however I know HIV and other STD's don't always show symptoms. He is not a drug user, or bisexual. Nor am I.",
HIV/AIDS,https://messageboards.webmd.com/health-conditions/f/hiv-aids/19477/are-these-ars-symptoms,Are these ARS Symptoms?,"Hello. About 2 months ago I had protected anal sex with a man and I performed fellatio, which resulted in semen getting onto my face and a tiny bit on my lip. I washed all areas of contact a few minutes later with soap and warm water. Four days ago at noon, I developed a fever with a high of 38.8 C as well as a stuffed nose.  After taking some flu medication my fever went away overnight, however I developed a sore throat the next day as well as congestion with wet stools.  I woke up to find my clothes wet with night sweats. It was bearable however and so I only took a single flu pill in the morning. Yesterday I woke up to night sweats again and found it very hard to swallow, so I had a check-up done. The doctor recommended confinement in the hospital, but allowed me to be treated at home provided I did not develop a fever. I was told that I had a weakened immune system and that I had developed a viral and bacterial infection and was possibly at risk for dehydration, but other than my sore throat I felt fine. Today I woke up to find my clothes wet by night sweats again, but nothing else. Are these early signs of an HIV infection? And would I be recommended to get tested?",
HIV/AIDS,https://messageboards.webmd.com/health-conditions/f/hiv-aids/19372/hiv-neuropathy-tingling---quick-question,HIV neuropathy ; tingling - Quick Question,"Hi Gail,  Does neuropathy; tingling sensation and burning in hands and feet happen in Advanced HIV stage? can you please suggest any other symptoms along with it.",Diagnosis
Kidney Disorders,https://messageboards.webmd.com/health-conditions/f/kidney-disorders/2601/how-well-do-you-really-know-your-kidneys,How well do you really know your kidneys?,"You're probably pretty familiar with your kidneys, but did you know these 5 amazing facts?",
Kidney Disorders,https://messageboards.webmd.com/health-conditions/f/kidney-disorders/1780/help,Help,I went to the ER on Sunday with UTI symptoms and sharp pains in my kidney area. They ONLY did a urine culture and vaginal swabs. Yesterday evening late I am sure I passed a stone but about an hour later I started having severe pain even worse than when I was pregnant and had a 7mm stone stuck. I previously had Uric Acid stones. What are the chances that I have another stone too large to pass and should I go to a different ER since they refused to do any blood work or a CT scan. Also I don't have a spleen and have been told I have to be extremely cautious any time I get sick.,
Kidney Disorders,https://messageboards.webmd.com/health-conditions/f/kidney-disorders/1893/lab-results,Lab results,Creatine 2.6 Free light chain kappa 13.40 Free light chain lambda 7.94 What does this mean?,
Kidney Disorders,https://messageboards.webmd.com/health-conditions/f/kidney-disorders/2991/high-creatinine-level-of-1-4-in-case-of-diabetic-patient,High Creatinine Level of 1.4 (in case of Diabetic patient),"Hi Sir/Madam, I need advice regarding my father's health. He is 66 years old and of Indian ethnicity. Yesterday his blood creatinine level has been reported to be 1.4mg/dl. He is on medication for Diabetes, high blood pressure, high uric adic and blood thinning (for clot in a brain nerve). His diabetes and BP are under control since more than one year. He had high Uric acid level (of 8.5) six months back but it is now under control (at 5.2). He has been adviced to take Zyloric to control Uric Acid. Is there anything to worry about for increased creatinine level of 1.4? Can anyone please recommend a good Nephrologist in Hyderabad we could consult with? Please advice. Thanks in advance. Regards, Riya.",Kidney Disease
Kidney Disorders,https://messageboards.webmd.com/health-conditions/f/kidney-disorders/3005/mass-removal-from-kidney,Mass Removal from Kidney,"I have a small mass located in my kidney, and would like to explore less intrusive surgeries than suggested to me. Assuming that the mass is benign, are there any procedures available to me besides the standard incisive-type, major surgery?",Kidney Cyst
Kidney Disorders,https://messageboards.webmd.com/health-conditions/f/kidney-disorders/3035/kidney-surgery-with-a-blood-clot,Kidney surgery with a blood clot,"If a patient is having kidney surgery, can the doctor perform the surgery if the patient has a blood clot in their leg?",Kidney Failure
Kidney Disorders,https://messageboards.webmd.com/health-conditions/f/kidney-disorders/2664/keep-or-repeal-obamacare-share-your-thoughts,Keep or Repeal Obamacare? Share Your Thoughts,"Currently about 20 million people get insurance through Obamacare, which guarantees coverage for services like preventive care but has been plagued with increases in premium costs. A recent WebMD survey found that most consumers wanted the law or parts of the law to remain, although not without changes. We asked some people to share their views of the law and how any changes will affect them. Here's what they said:    What are your thoughts?",
Kidney Disorders,https://messageboards.webmd.com/health-conditions/f/kidney-disorders/2230/constant-urination,Constant urination,Repeated urination,Kidney Failure
HIV/AIDS,https://messageboards.webmd.com/health-conditions/f/hiv-aids/12577/hiv-test,Hiv test,Whether regular intake of alcohal say 150ml daily affects hiv antibody test. If so then which test to be used for this.,Diagnosis
HIV/AIDS,https://messageboards.webmd.com/health-conditions/f/hiv-aids/12581/delayed-antibody-formatin-cases,Delayed antibody formatin cases,"In some cases, formation of antibodies in hiv infection is delayed due to certain reasons. How to test such cases.",Possible Exposure
HIV/AIDS,https://messageboards.webmd.com/health-conditions/f/hiv-aids/12834/news-monthly-injection-might-revolutionize-hiv-care,News: Monthly Injection Might Revolutionize HIV Care,"New research suggests that injectable, long-acting antiretroviral therapy for HIV is as safe and effective as oral medications. Click here to read more:","Risk Factors , Living & Managing , Possible Exposure , Symptoms , Treatment , Diagnosis , Home Testing Kits"
HIV/AIDS,https://messageboards.webmd.com/health-conditions/f/hiv-aids/13687/are-my-test-conclusive,Are my Test Conclusive,"I have concern ragrding hiv and std. I had an exposure with CSW in sept16. I used condom for the vaginal sex. But since I lost erection in between i removed the condom using palm and with the same hand I touched my penis and foreskin immideatly. Since the vaginal fluid was there on the condom & i used the same hand to touch my genital inner foreskin and Glans of penis,can i be infected for hiv and std. After 3 months I developed red rashes on my right arm which disappeard with in 3 to 4 days. And since than feeling cronic fatigue,weight loss,loss of appetite,muscle pain & Body pain,pain in eyes, I have gone through 6 hiv test(3 rapid test,2 -3rd gen antibody hiv screening ECLIA method ,1- combo test p24 cmia method (at 8 month), inbetween 3 to 9 months of incedence which all are non-reactive Tested for hep B,C,VDRL, siphilis,urine culture, CBC at 4 months also. All are non reactive  except CBC in which total leyucocytes count is 13700 and in absolute leucocyte count -neutrophills9.70thou/mm3,lymphocytes 3.22 thou/mm3 which are above normal range. Now i Got red scratch like rash on my face after 10 months. Can i be amongst the seronegative persons who does not produce antibody for HIV because of their genitic reasons?? In current report of CBC my TLC is 13000 and lymphocytes% is 15.9% which is below the normal range Seeing all the symptoms and CBC report should i go for further testing.would you suggest PCR test for Hiv. Do The test done in the private laboratory has its authenticity in india or it may be wrongly reported to avoid the process of reporting it to the local govt. Healthcare authority.?? ARE MY TEST CONCLUSIVE?? I am in a bit of a panic so would appreciate some advice. Thanks","Risk Factors , Possible Exposure"
HIV/AIDS,https://messageboards.webmd.com/health-conditions/f/hiv-aids/13561/probably-should-get-tester-but,Probably should get tester but ..,"I've had 2 girlfriends in my life , about 1 year ago and an half I was having unprotected sex with her often. When we broke up she admitted having Oral herpes, and she did gave me some oral sex. The year pass but I didn't see anything strange in my genitals area. Recently I had a girlfriend for 2 month we only had protected sex together but she did gave me some oral Sex with no condoms. Its been a month that we're no longer together and it may sound weird but its the first time I keep injuring my self while masturbating. I have Red Marks, see pictures, and it always hurts. I was wondering if this is Aids or it's just That I masturbate too often With nothing to lubricate. I would say I masturbate about 5 times a week. Thanks a lot for futur answers !  Sry for the english it's my second language","Risk Factors , Possible Exposure , Symptoms , Treatment , Diagnosis"
HIV/AIDS,https://messageboards.webmd.com/health-conditions/f/hiv-aids/11974/hiv-exposure,HIV exposure ?,"Hi,  I have recently had a sexual encounter at a club and I am super anxious of whether I have had HIV exposure. I have given a blowjob ( with a condom on to a guy . There was no ejaculation. I have made accidental contact between my anus and his penis (still with a condom) when I was rubbing on him and it happened. I got waxed just an hour before and there was bleeding, does this put me in danger. Please help. I am going nuts with anxiety. Cindy","Risk Factors , Possible Exposure"
HIV/AIDS,https://messageboards.webmd.com/health-conditions/f/hiv-aids/19080/when-you-re-living-in-africa,When you're living in Africa,"As we don't have this internet , and i want to help other people with HIV , how can I reach them , or any helpful experience .",Living & Managing
Kidney Disorders,https://messageboards.webmd.com/health-conditions/f/kidney-disorders/1903/i-wonder-what-my-doctor-is-thinking,I wonder what my doctor is thinking,"Two summers ago, I dehydrated three times. I got everything that was going around that summer and my usual 125 weight went down to 87. The final ER discharge said, among other things, Acute chronic kidney failure, right. My numbers whack out from time to time, though BUN is always high. Sometimes so is creatinine serum and glomular filtration rate is low. My doctor says this isn't really evidence of kidney damage. I ask what it is evidence of, then. Recently, he learned that I had heat stroke at 5 (hospital for 6 weeks) and at 32 (hospital for a month [in the intervening years I think doctors learned that re-hydrating isn't enough; you have to reestablish electrolyte levels, too]) and so that means that of course I'm just dehydrating regularly and that's why the numbers go wonky. The ER doctor who diagnosed the kidney damage is the Director of Emergency Medicine at our medical complex. He is a very highly respected member of the medical community and he personally designed a new ER that is never overcrowded and employs only ER trained doctors; not just every doctor who comes along. He has not, in his career, been found to have made a single mistake. Yes, I have a tremendous amount of respect for this man. And my doctor says his diagnosis is wrong; I have no kidney damage. So why does my BUN always stay high, and why maybe twice a month, do the other two wonk out? Is it simply a sign that I'm not drinking enough? Or is it evidence of chronic kidney damage?",Kidney Disease
HIV/AIDS,https://messageboards.webmd.com/health-conditions/f/hiv-aids/18990/is-there-a-chance-i-may-have-contracted-this-h-i-v-virus,Is there a chance I may have contracted this H.I.V virus ?,"I had sex with a girl I don't even know well , before she touched my dick with her hands and pull back my foreskin and touched my penis head after that proceeded to have protected sex and we saw some blood, it wasn't mines it was hers, I thought that her period came down but a day passed she told me her period didnt came ,she doesn't know what it is, so that's weird to me (can you tell me what it might of been also), we stopped when we saw the blood ,there where drips of blood on my briefs ,I made sure and pull off the condom with the blood on it carefully and raise my penis head upward to hit the shower first , then I poisitioned myself so the shower can hit the pubic hair area just in case there is blood I cannot see, which I wasn't seeing because it was kind of dark , while bathing I yanked one of my pubic hair by mistake and yes I bathed with soap after, after I did all those thing I made sure the condom had no breakage , I never ejaculated , I ended up kissing her and sucking her breast also , there was no signs of anything coming out her breast while squeezing it before , I ended up carrying her for a taxi 10 mins after the incident and I came back home for a half hour and get ready to go out , I noticed I had food between my teeth , so I picked it and it started bleeding and I thought about how I was kissing her , is there any H.I.V transmission or any disease at all in this whole scenario , her status is unknown to me ,thanks for your answer in advance","Risk Factors , Possible Exposure"
HIV/AIDS,https://messageboards.webmd.com/health-conditions/f/hiv-aids/18996/am-i-conclusively-hiv-negative-with-four-negative-oraquick-results,Am I conclusively HIV negative with four negative OraQuick results?,"I took four OraQuick at-home HIV tests (90,91,94 and 104 days) and they all came out negative with a line next to the C and no line next to the T. Does that mean that I am conclusively negative?",Home Testing Kits
Kidney Disorders,https://messageboards.webmd.com/health-conditions/f/kidney-disorders/1589/copper-poisoning,Copper poisoning,Last night at work we had a compressor go out which put copper into our water. I literally drank two pots of coffee throughout the night and today I don't feel very well and I can't get the taste of blood out of my mouth. What should I do? There wasn't an option for poisoning so I posted under kidneys.,
HIV/AIDS,https://messageboards.webmd.com/health-conditions/f/hiv-aids/19009/protected-sex-but-have-some-doubt,Protected sex but have some doubt,"I had sex a month back with an IT girl,i used condom for sex but didn't used it for blowjob.I am scared of HIV now, though there was not any kind of blood exchange but still i am worried.Later i asked her that how many times she had sex, she said its 4 times.Can any one help me clearing my doubt?","Risk Factors , Possible Exposure , Symptoms"
HIV/AIDS,https://messageboards.webmd.com/health-conditions/f/hiv-aids/20800/possible-ars-symptoms,possible ars symptoms,"I had a high rish exposure about 5 weeks ago during anal intercourse with a man of unknown status the condom broke. Anyways about a little over a week ago i had a sore throat for about a day which developed into what resembled a mild cold (congestion, sneezing, runny nose) no fever. As those symptoms subsided i started getting sharp pains all over my body pretty much from head to toe. It will appear in one spot for a few second then reappear in another. There are some times they dont happen at all. The seem be causing achey joints as well. Not unbearable but like after a good workout. I tested 10 days after exposure with the duo test and was negative. I know it may have been too soon but i will test again at the three month mark. Do these symptoms sound like they could be related to ars? I am also just got three injections of bicillin as treatmemt for syphilis. Im hoping this is just side efgects from meds but im freaking out a little.","Possible Exposure , Symptoms"
Kidney Disorders,https://messageboards.webmd.com/health-conditions/f/kidney-disorders/3489/can-hypoglycemia-result-after-kidney-removal,Can hypoglycemia result after kidney removal?,"My brother recently underwent a nephrectomy (kidney removal) and now is having very low blood sugar readings in the mornings before breakfast, such as 46-55. He will be talking to his doctor about this, but I wondered if anyone in this forum had any experience with this situation. He takes medicines and insulin for his diabetes, and has always been able to keep his blood sugar regulated until now.",Kidney Disease
HIV/AIDS,https://messageboards.webmd.com/health-conditions/f/hiv-aids/20121/question-about-exposure-and-chances-of-infection,Question about exposure and chances of infection.,"I suffer from both extreme OCD and anxiety so bear with me. Today while I was at work I had two friends come up to me. One gave me a high five and the other shook my hand. Due to the dry weather and over-washing, I had cracks both on the back of my hand and on my wrist, some of which were actively bleeding at the time. I realized this and quickly went to the restroom to wash. It probably took me under a minute afterwards to go and get washed up. I didn't notice any blood on my hand but the thought still bugged me. Assuming there was blood and enough of it, what is my risk? Could the water from washing push it in my bleeding sores? Also, does it only take one wash to clean blood off? Sorry this is really beating me up. Thanks.",Risk Factors
Kidney Disorders,https://messageboards.webmd.com/health-conditions/f/kidney-disorders/905/left-renal-pelvis-fullness-with-no-symptoms,Left Renal Pelvis Fullness with no symptoms,"My ultra sound showed ""Left Renal Pelvis Fullness"" but I have no symptoms and all blood and urine tests are normal. What is the odd this can be serious if I choose to do nothing for now? What other tests can be done to keep this in check? What are possible procedures to drain the urine if necessary? I shy away from CT scans for radiation concern since I have had multiple CT's in other areas in the past.",
Kidney Disorders,https://messageboards.webmd.com/health-conditions/f/kidney-disorders/1380/think-you-have-a-kidney-stone-what-to-know,Think you have a kidney stone? What to know:,"Kidney stones can range in size from a sugar crystal to a ping pong ball, and if you've ever had one, you know they can cause intense pain. Think you might have one? Here's what you should know about symptoms, home care, and when it may be time to see the doctor:    Have you ever had a kidney stone? What was your experience? Sign in or sign up to join the conversation.",Kidney Stones
Kidney Disorders,https://messageboards.webmd.com/health-conditions/f/kidney-disorders/1147/is-barberry-bark-extract-bad-for-kidney-disease,Is barberry bark extract bad for kidney disease?,I want to find a answer to that question Is Barberry Bark Extract bad to take if you have kidney disease? Does anyone know?,Kidney Disease
